{
  "job_id": "example-fix-checker",
  "intent": "修复 cjson_leak_checker 对空 JSON 字符串的误报：空字符串不应触发 C3 泄漏警告",
  "created_at": "2026-07-02T12:00:00Z",
  "priority": "normal",
  "allowed_paths": ["tools/cjson_leak_checker.py", "tools/fixtures/"],
  "risk_preference": "auto_low",
  "max_iterations": 2,
  "require_clean_worktree": true,
  "isolation_mode": "branch",
  "verification_commands": [
    {"cmd": "python tools/cjson_leak_checker.py --self-test", "description": "cjson checker self-test"}
  ],
  "acceptance_criteria": [
    "空 JSON 字符串不触发 C3 警告",
    "原有 bad_cjson.c 测试仍然检出违规",
    "self-test 通过"
  ],
  "rollback_strategy": "delete_branch",
  "tags": ["checker", "cjson", "P1"]
}
